{
  "$schema": "https://json-schema.org/draft/2020-12/schema",
  "$id": "https://evemisslab.com/spec/FARHP_Session_Checkpoint_Spec_v0.8.schema.json",
  "title": "FARHP WebLab Session Checkpoint v0.8",
  "type": "object",
  "required": [
    "farhp_weblab_checkpoint_version",
    "saved_at",
    "plan",
    "session"
  ],
  "properties": {
    "farhp_weblab_checkpoint_version": {
      "const": "0.8"
    },
    "saved_at": {
      "type": "string"
    },
    "plan": {
      "title": "FARHP WebLab Research Plan v0.8",
      "type": "object",
      "required": [
        "farhp_weblab_plan_version",
        "study_id",
        "task",
        "planned_sample_size",
        "primary_endpoint",
        "design",
        "exclusion_policy",
        "governance",
        "status",
        "created_at",
        "locked_at",
        "plan_fingerprint"
      ],
      "properties": {
        "farhp_weblab_plan_version": {
          "const": "0.8"
        },
        "study_id": {
          "type": "string",
          "minLength": 1,
          "maxLength": 64
        },
        "task": {
          "const": "multi_stimulus_ABX_identity_match"
        },
        "planned_sample_size": {
          "type": "integer",
          "minimum": 1
        },
        "primary_endpoint": {
          "const": "abx_accuracy_vs_0_5"
        },
        "preregistration_note": {
          "type": "string",
          "maxLength": 1200
        },
        "design": {
          "type": "object",
          "required": [
            "selected_stimuli",
            "altered_condition",
            "intervention_strength",
            "repeats_per_stimulus",
            "practice_trials",
            "break_every_main_trials",
            "seed",
            "ordering",
            "blinding"
          ],
          "properties": {
            "selected_stimuli": {
              "type": "array",
              "minItems": 2,
              "uniqueItems": true,
              "items": {
                "type": "string"
              }
            },
            "altered_condition": {
              "enum": [
                "zero",
                "alternating",
                "random",
                "curved"
              ]
            },
            "intervention_strength": {
              "type": "number",
              "minimum": 0,
              "maximum": 1
            },
            "repeats_per_stimulus": {
              "type": "integer",
              "minimum": 1
            },
            "practice_trials": {
              "type": "integer",
              "minimum": 0
            },
            "break_every_main_trials": {
              "type": "integer",
              "minimum": 0
            },
            "seed": {
              "type": "integer",
              "minimum": 1
            },
            "ordering": {
              "type": "string"
            },
            "blinding": {
              "type": "string"
            }
          },
          "additionalProperties": true
        },
        "exclusion_policy": {
          "type": "object",
          "required": [
            "min_rt_ms",
            "max_rt_ms",
            "min_completion_ratio",
            "min_valid_trial_ratio",
            "min_plays_each_label",
            "accuracy_based_exclusion"
          ],
          "properties": {
            "min_rt_ms": {
              "type": "number",
              "minimum": 0
            },
            "max_rt_ms": {
              "type": "number",
              "exclusiveMinimum": 0
            },
            "min_completion_ratio": {
              "type": "number",
              "minimum": 0,
              "maximum": 1
            },
            "min_valid_trial_ratio": {
              "type": "number",
              "minimum": 0,
              "maximum": 1
            },
            "min_plays_each_label": {
              "type": "integer",
              "minimum": 0
            },
            "accuracy_based_exclusion": {
              "const": false
            }
          },
          "additionalProperties": true
        },
        "status": {
          "enum": [
            "draft",
            "locked"
          ]
        },
        "created_at": {
          "type": "string"
        },
        "locked_at": {
          "type": [
            "string",
            "null"
          ]
        },
        "plan_fingerprint": {
          "oneOf": [
            {
              "type": "null"
            },
            {
              "type": "object",
              "required": [
                "algorithm",
                "value"
              ],
              "properties": {
                "algorithm": {
                  "type": "string",
                  "minLength": 1
                },
                "value": {
                  "type": "string",
                  "pattern": "^[0-9a-f]{64}$"
                }
              },
              "additionalProperties": false
            }
          ]
        },
        "governance": {
          "type": "object",
          "required": [
            "research_role",
            "consent_template",
            "direct_identifiers_forbidden",
            "local_processing_only",
            "audit_policy",
            "deidentification_policy"
          ],
          "properties": {
            "research_role": {
              "enum": [
                "principal_investigator",
                "data_collector",
                "analyst"
              ]
            },
            "consent_template": {
              "type": "object",
              "required": [
                "version",
                "title",
                "summary",
                "affirmative_consent_required",
                "eligibility_attestation_required"
              ],
              "properties": {
                "version": {
                  "type": "string",
                  "minLength": 1,
                  "maxLength": 64
                },
                "title": {
                  "type": "string",
                  "minLength": 1,
                  "maxLength": 160
                },
                "summary": {
                  "type": "string",
                  "minLength": 1,
                  "maxLength": 2000
                },
                "affirmative_consent_required": {
                  "const": true
                },
                "eligibility_attestation_required": {
                  "const": true
                }
              },
              "additionalProperties": false
            },
            "direct_identifiers_forbidden": {
              "const": true
            },
            "local_processing_only": {
              "const": true
            },
            "audit_policy": {
              "type": "object",
              "required": [
                "live_chain",
                "sealed_chain"
              ],
              "properties": {
                "live_chain": {
                  "type": "string"
                },
                "sealed_chain": {
                  "type": "string"
                }
              },
              "additionalProperties": false
            },
            "deidentification_policy": {
              "type": "string",
              "minLength": 1
            }
          },
          "additionalProperties": false
        }
      },
      "additionalProperties": true
    },
    "session": {
      "type": "object",
      "required": [
        "session_id",
        "study_id",
        "participant_id",
        "created_at",
        "current_index",
        "on_break",
        "break_count",
        "trials"
      ],
      "properties": {
        "session_id": {
          "type": "string",
          "minLength": 1
        },
        "study_id": {
          "type": "string"
        },
        "participant_id": {
          "type": "string",
          "minLength": 1
        },
        "created_at": {
          "type": "string"
        },
        "completed_at": {
          "type": [
            "string",
            "null"
          ]
        },
        "current_index": {
          "type": "integer",
          "minimum": 0
        },
        "on_break": {
          "type": "boolean"
        },
        "break_count": {
          "type": "integer",
          "minimum": 0
        },
        "trials": {
          "type": "array",
          "items": {
            "type": "object",
            "required": [
              "sequence_index",
              "play_counts",
              "response"
            ],
            "properties": {
              "sequence_index": {
                "type": "integer",
                "minimum": 1
              },
              "play_counts": {
                "type": "object",
                "required": [
                  "A",
                  "B",
                  "X"
                ],
                "properties": {
                  "A": {
                    "type": "integer",
                    "minimum": 0
                  },
                  "B": {
                    "type": "integer",
                    "minimum": 0
                  },
                  "X": {
                    "type": "integer",
                    "minimum": 0
                  }
                },
                "additionalProperties": false
              },
              "started_at_ms": {
                "type": [
                  "number",
                  "null"
                ]
              },
              "response": {
                "oneOf": [
                  {
                    "type": "null"
                  },
                  {
                    "type": "object",
                    "required": [
                      "answer",
                      "rt_ms",
                      "submitted_at"
                    ],
                    "properties": {
                      "answer": {
                        "enum": [
                          "A",
                          "B"
                        ]
                      },
                      "rt_ms": {
                        "type": "number",
                        "minimum": 0
                      },
                      "submitted_at": {
                        "type": "string"
                      }
                    },
                    "additionalProperties": true
                  }
                ]
              }
            },
            "additionalProperties": true
          }
        },
        "governance": {
          "type": [
            "object",
            "null"
          ],
          "additionalProperties": true
        },
        "audit_log": {
          "type": "array",
          "items": {
            "type": "object",
            "required": [
              "index",
              "timestamp",
              "type",
              "payload",
              "prev_hash",
              "hash"
            ],
            "properties": {
              "index": {
                "type": "integer",
                "minimum": 1
              },
              "timestamp": {
                "type": "string"
              },
              "type": {
                "type": "string",
                "minLength": 1
              },
              "payload": {
                "type": "object"
              },
              "prev_hash": {
                "type": "string",
                "minLength": 1
              },
              "hash": {
                "type": "string",
                "pattern": "^[0-9a-f]{64}$"
              }
            },
            "additionalProperties": false
          }
        }
      },
      "additionalProperties": true
    },
    "privacy_note": {
      "type": "string"
    }
  },
  "additionalProperties": true
}