{
  "farhp_weblab_checkpoint_version": "0.8",
  "saved_at": "2026-07-31T06:50:00Z",
  "plan": {
    "created_at": "2026-07-31T06:41:53.709Z",
    "design": {
      "altered_condition": "zero",
      "blinding": "formal-trial A/B mapping and correctness hidden until completion",
      "break_every_main_trials": 1,
      "intervention_strength": 0.75,
      "ordering": "participant_indexed_latin_or_cyclic_order_plus_balanced_ABX_cells",
      "practice_trials": 1,
      "repeats_per_stimulus": 1,
      "seed": 424242,
      "selected_stimuli": [
        "nihao",
        "nihaoma"
      ]
    },
    "exclusion_policy": {
      "accuracy_based_exclusion": false,
      "max_rt_ms": 30000,
      "min_completion_ratio": 1,
      "min_plays_each_label": 1,
      "min_rt_ms": 150,
      "min_valid_trial_ratio": 0.8
    },
    "farhp_weblab_plan_version": "0.8",
    "governance": {
      "audit_policy": {
        "live_chain": "FNV32x8-live",
        "sealed_chain": "SHA-256-when-available"
      },
      "consent_template": {
        "affirmative_consent_required": true,
        "eligibility_attestation_required": true,
        "summary": "Anonymous browser regression study.",
        "title": "Test consent",
        "version": "FARHP-CONSENT-TEST-v0.8"
      },
      "deidentification_policy": "study-specific one-way pseudonym for analysis export",
      "direct_identifiers_forbidden": true,
      "local_processing_only": true,
      "research_role": "principal_investigator"
    },
    "locked_at": "2026-07-31T07:04:27.936976+00:00",
    "plan_fingerprint": {
      "algorithm": "SHA-256",
      "value": "3f16b9795be8dd7278d56e09f067bd5efc879a5bcae55d48b6ea7cdfeebd1a67"
    },
    "planned_sample_size": 12,
    "preregistration_note": "Primary endpoint fixed before collection.",
    "primary_endpoint": "abx_accuracy_vs_0_5",
    "status": "locked",
    "study_id": "FARHP-DEPLOY-TEST",
    "task": "multi_stimulus_ABX_identity_match"
  },
  "session": {
    "session_id": "S-19a3282786d6443dfb5c46b7",
    "study_id": "FARHP-DEPLOY-TEST",
    "participant_id": "P-A7E41D59A5EB",
    "created_at": "2026-07-31T06:49:00Z",
    "completed_at": null,
    "current_index": 1,
    "on_break": false,
    "break_count": 0,
    "governance": null,
    "audit_log": [],
    "trials": []
  },
  "privacy_note": "demo lightweight checkpoint"
}